"﻿Number","Question","What was the problem type?","What was the problem?","How would you fix it?","Answer","Commit","Comment"
"1","INSERT INTO spell_proc_event VALUES (54488, 0x00, 0, 0x20000021, 0x00009000, 0x00000000, 0x00000000, 0x00000000, 0, 0, 0), (54489, 0x00, 0, 0x20000021, 0x00009000, 0x00000000, 0x00000000, 0x00000000, 0, 0, 0), (54490, 0x00, 0, 0x20000021, 0x00009000, 0x00000000, 0x00000000, 0x00000000, 0, 0, 0), (54646, 0x00, 0, 0x00000000, 0x00000000, 0x00000000, 0x00000000, 0x00000002, 0, 0, 0); (54695, 0x00, 0, 0x00000000, 0x00000000, 0x00000000, 0x00000000, 0x00000000, 0, 0, 45), (54707, 0x00, 0, 0x00000000, 0x00000000, 0x00000000, 0x00000000, 0x00000000, 0, 0, 60), (54738, 0x00, 0, 0x00000000, 0x00000000, 0x00000000, 0x00000000, 0x00000002, 0, 0, 45);","bug","A semicolon ends the INSERT statement too early, so the remaining rows are not included in the same INSERT.","Replace the semicolon after the row with entry 54646 with a comma, so all rows stay inside the same INSERT statement.","INSERT INTO spell_proc_event VALUES (54488, 0x00, 0, 0x20000021, 0x00009000, 0x00000000, 0x00000000, 0x00000000, 0, 0, 0), (54489, 0x00, 0, 0x20000021, 0x00009000, 0x00000000, 0x00000000, 0x00000000, 0, 0, 0), (54490, 0x00, 0, 0x20000021, 0x00009000, 0x00000000, 0x00000000, 0x00000000, 0, 0, 0), (54646, 0x00, 0, 0x00000000, 0x00000000, 0x00000000, 0x00000000, 0x00000002, 0, 0, 0), (54695, 0x00, 0, 0x00000000, 0x00000000, 0x00000000, 0x00000000, 0x00000000, 0, 0, 45), (54707, 0x00, 0, 0x00000000, 0x00000000, 0x00000000, 0x00000000, 0x00000000, 0, 0, 60), (54738, 0x00, 0, 0x00000000, 0x00000000, 0x00000000, 0x00000000, 0x00000002, 0, 0, 45);","7798474e74e39e4a3bb712cdc194f833bc16e3d5",""
"2","ALTER TABLE event_log_email DROP COLUMN max_following_teacher;","bug","The ALTER TABLE statement uses the wrong table name. The rollback tries to drop max_following_teacher from event_log_email, although the corrected commit shows that the column should be dropped from m_plan.","Use the correct table name in the ALTER TABLE statement.","ALTER TABLE m_plan DROP COLUMN max_following_teacher;","fa2a91a1177aa4af3f44154cf932d442b1f3212a",""
"3","SET @ENTRY := 2287 DELETE FROM `creature_text` WHERE `entry`=@ENTRY;","bug","The first SQL statement is missing a semicolon, so the SET statement and the DELETE statement are joined together incorrectly.","Add a semicolon after the SET statement before starting the DELETE statement.","SET @ENTRY := 2287; DELETE FROM `creature_text` WHERE `entry`=@ENTRY;","937fcc38100c46edfad89e62bdcc85d0a0f79b4d",""
"4","INSERT INTO `authorised_values` (`category`, `authorised_value`, `lib`) VALUES ('COUNTRY', 'CC', 'Cocos, île des'); INSERT INTO `authorised_values` (`category`, `authorised_value`, `lib`) VALUES ('COUNTRY', 'CC', 'Keeling');","data integrity","The same lookup value is inserted twice. Both rows use the same category and authorised_value, but with different labels.","Remove the duplicate row and keep only one value for the same category and authorised_value.","INSERT INTO `authorised_values` (`category`, `authorised_value`, `lib`) VALUES ('COUNTRY', 'CC', 'Cocos, île des');","323e1a2a2f28881e6aed13c78df1d0a3d5069c4e",""
"5","SELECT af.uri, (SELECT COALESCE(SUM(sub_af.transaction_obligated_amou::numeric),0) FROM award_financial_c23_4_{0} AS sub_af WHERE sub_af.uri = af.uri) AS transaction_obligated_amou_sum, (SELECT COALESCE(SUM(sub_afa.federal_action_obligation),0) FROM award_financial_assistance_c23_4_{0} AS sub_afa WHERE sub_afa.uri = af.uri AND COALESCE(sub_afa.assistance_type,'') NOT IN ('07','08')) AS federal_action_obligation_sum FROM award_financial_c23_4_{0} AS af;","performance","The query calculates sums with correlated subqueries. These subqueries may run again for many rows, which can make the query slower on large tables.","Calculate the sums once by grouping each table by uri, and then join the grouped results.","WITH award_financial_grouped AS (SELECT uri, COALESCE(SUM(transaction_obligated_amou::numeric),0) AS transaction_obligated_amou_sum FROM award_financial_c23_4_{0} GROUP BY uri), award_financial_assistance_grouped AS (SELECT uri, COALESCE(SUM(federal_action_obligation),0) AS federal_action_obligation_sum FROM award_financial_assistance_c23_4_{0} WHERE COALESCE(assistance_type,'') NOT IN ('07','08') GROUP BY uri) SELECT af.uri, af.transaction_obligated_amou_sum, afa.federal_action_obligation_sum FROM award_financial_grouped AS af JOIN award_financial_assistance_grouped AS afa ON af.uri = afa.uri;","b3012cd21fba52a1e8309aab3807ab09ddbb9d0f",""
